id,title,category,sub_category,caption,location,pages,description,keywords,dateNormalized,date,medium,size,creator,collection,provenanceTMI08002,U.S. Government Building,photographs,grand court,,"Grand Court, West",,U.S. Government Building and portion of south west colonnade. Crowd seated on steps. Lagoon with docked boats.,,,,photograph,"7"" x 5.5"" album pages with 4.5"" x 3.5"" photo openings",,collection of Jeffrey Spencer,Jeffrey SpencerTMI08003,Arch of States,photographs,grand court,,"Grand Court, South",,Arch of States looking north. Administration Arch visible through archway. ,,,,photograph,"7"" x 5.5"" album pages with 4.5"" x 3.5"" photo openings",,collection of Jeffrey Spencer,Jeffrey SpencerTMI08004,"Grand Court, Looking Southwest",photographs,grand court,,"Grand Court, South West",,"View across lagoon of Grand Court, looking southwest toward Mines and Mining, Liberal Arts, Fine Arts, Building, balustraded island, and U.S. Government Building. Swan boat and gondolas docked. Benches and electric light columns in foreground.",,,,photograph,"7"" x 5.5"" album pages with 4.5"" x 3.5"" photo openings",,collection of Jeffrey Spencer,Jeffrey SpencerTMI08005,East End of Lagoon,photographs,grand court,,"Grand Court, East",,East end of lagoon. Gondola and Swan boat docked in water. Planter in foreground. Machinery and Electricity Building to the north. Rinehart Studio and Grand Colonnade to the east. A few spectators descending the staircase to lagoon.,,,,photograph,"7"" x 5.5"" album pages with 4.5"" x 3.5"" photo openings",,collection of Jeffrey Spencer,Jeffrey SpencerTMI08006,"Grand Court, Looking Northwest",photographs,grand court,,"Grand Court, North",,"View of grand court, looking northwest. Machinery and Electricity and Manufacturers Buildings, Administration Arch, Agriculture Building, balustraded island, and U.S. Government Building to the West. Spectators walking in foreground. ",,,,photograph,"7"" x 5.5"" album pages with 4.5"" x 3.5"" photo openings",,collection of Jeffrey Spencer,Jeffrey SpencerTMI08007,Mines and Mining Building,photographs,grand court,,"Grand Court, South East",,Mines and Mining Building and colonnade. East end of lagoon with garden and benches visible. Crowd walking.,,,,photograph,"7"" x 5.5"" album pages with 4.5"" x 3.5"" photo openings",,collection of Jeffrey Spencer,Jeffrey SpencerTMI08008,Manufactures Building and Colonnade,photographs,grand court,,"Grand Court, North",,Section of Manufactures Building with Colonnade. ,,,,photograph,"7"" x 5.5"" album pages with 4.5"" x 3.5"" photo openings",,collection of Jeffrey Spencer,Jeffrey SpencerTMI08009,Machinery and Electricity Building,photographs,grand court,,"Grand Court, North East",,View of Machinery and Electricity Building from across lagoon. Grand Colonnade and Moorish Palace visible in distance to the east.,,,,photograph,"7"" x 5.5"" album pages with 4.5"" x 3.5"" photo openings",,collection of Jeffrey Spencer,Jeffrey SpencerTMI08010,Grand Colonnade,photographs,grand court,,"Grand Court, South East",,Grand Colonnade. Auditorium visible in background. Gondola docked in lagoon. Staircase leading to lagoon. Small portion of Mines and Mining Building visible to the south.,,,,photograph,"7"" x 5.5"" album pages with 4.5"" x 3.5"" photo openings",,collection of Jeffrey Spencer,Jeffrey SpencerTMI08011,Machinery and Electricity Building,photographs,grand court,,"Grand Court, North East",,"Machinery and Electricity Building, looking northwest. Stairs leading to lagoon, with gondolas docked. Benches and light crowd, seated and walking, in foreground.",,,,photograph,"7"" x 5.5"" album pages with 4.5"" x 3.5"" photo openings",,collection of Jeffrey Spencer,Jeffrey SpencerTMI08012,East End of Lagoon,photographs,grand court,,"Grand Court, East",,"East end of lagoon, looking south. Auditorium visible beyond tiered gardens and Grand Colonnade. Mines and Mining Building visible to the west. Three blurred spectators in foreground.",,,,photograph,"7"" x 5.5"" album pages with 4.5"" x 3.5"" photo openings",,collection of Jeffrey Spencer,Jeffrey SpencerTMI08013,Fine Arts Building,photographs,grand court,,"Grand Court, South West",,View across lagoon looking south toward Fine Arts Building and balustraded island.,,,,photograph,"7"" x 5.5"" album pages with 4.5"" x 3.5"" photo openings",,collection of Jeffrey Spencer,Jeffrey SpencerTMI08014,East End of Lagoon,photographs,grand court,,"Grand Court, North East",,View across lagoon toward staircase leading up to grand court. Gondola docked in water. Grand Colonnade with roofline of Moorish Palace visible. Corner of Machinery and Electricity Building visible to the west.,,,,photograph,"7"" x 5.5"" album pages with 4.5"" x 3.5"" photo openings",,collection of Jeffrey Spencer,Jeffrey SpencerTMI08015,Twin Tower Restaurant and Grand Colonnade,photographs,grand court,,"Grand Court, North East",,"Girls and Boys Building with signage for The Home Restaurant. Twin Tower Restaurant, and Grand Colonnade, looking northeast. Light crowd walking. Concession stand to the east.",,,,photograph,"7"" x 5.5"" album pages with 4.5"" x 3.5"" photo openings",,collection of Jeffrey Spencer,Jeffrey SpencerTMI08016,Balustraded Island,photographs,grand court,,"Grand Court, North West",,"Balustraded Island with garden and planter, looking northeast toward Manufacturers Building. Machinery and Electricity Building, Twin Tower Restaurants, and Grand Colonnade visible in background.",,,,photograph,"7"" x 5.5"" album pages with 4.5"" x 3.5"" photo openings",,collection of Jeffrey Spencer,Jeffrey SpencerTMI08017,Mines and Mining Building,photographs,grand court,,"Grand Court, South East",,"Mines and Mining Building, looking  west. Liberal Arts, Fine Arts, and U.S. Government Buildings in background. Fire hydrant in foreground.",,,,photograph,"7"" x 5.5"" album pages with 4.5"" x 3.5"" photo openings",,collection of Jeffrey Spencer,Jeffrey SpencerTMI08018,Bemis Brothers Bag Company Building,photographs,bluff tract,,"Bluff Tract, North West",,"Bemis Brothers Bag Company Building, looking northwest. Signage reads ""Bemis, Boston, St. Louis, Minneapolis, New Orleans, West Superior, Indianapolis, San Francisco, Omaha."" Patriotic bunting mounted above entrance. Machinery and Electricity Building visible to the northwest. Corner of Montgomery Ward Building to the north.",,,,photograph,"7"" x 5.5"" album pages with 4.5"" x 3.5"" photo openings",,collection of Jeffrey Spencer,Jeffrey SpencerTMI08019,Remember the Maine Display,photographs,exhibits,,"Grand Court, West",,"Interior of  U.S. Government Building. ""Remember the Maine"" display with model of USS Maine (ACR-1).",,,,photograph,"7"" x 5.5"" album pages with 4.5"" x 3.5"" photo openings",,collection of Jeffrey Spencer,Jeffrey SpencerTMI08020,Detail of Grand Colonnade,photographs,grand court,,"Grand Court, East",,"Grand Colonnade, looking east, with Twin Tower Restaurants in background. Man stands in foreground.",,,,photograph,"7"" x 5.5"" album pages with 4.5"" x 3.5"" photo openings",,collection of Jeffrey Spencer,Jeffrey SpencerTMI08021,Statue of Ceres,photographs,grand court,,"Grand Court, North East",,Detail of Manufactures Building and Colonnade with Statue of Ceres in foreground. Potted plant at base of statue.,,,,photograph,"7"" x 5.5"" album pages with 4.5"" x 3.5"" photo openings",,collection of Jeffrey Spencer,Jeffrey SpencerTMI08022,Midway - U.S. vs. Spain,photographs,midway,,"North Midway, West",,"Remember the Maine. Signage reads: ""U.S. Versus Spain. Havana and the Maine. A Realistic Production on Real Water. Admission 10 Cents."" A few spectators walk by. Haunted Swing to the east.",,,,photograph,"7"" x 5.5"" album pages with 4.5"" x 3.5"" photo openings",,collection of Jeffrey Spencer,Jeffrey SpencerTMI08023,Nebraska State Building,photographs,bluff tract,,"Bluff Tract, North West",,"Nebraska State Building. Trees, concession stand, and light crowd in front.",,,,photograph,"7"" x 5.5"" album pages with 4.5"" x 3.5"" photo openings",,collection of Jeffrey Spencer,Jeffrey SpencerTMI08024,Pottawattamie County Wigwam,photographs,bluff tract,,"Bluff Tract, West",,Pottawattamie County Wigwam. A pair of men walking in foreground. Star Tobacco Building and light crowd to the north. ,,,,photograph,"7"" x 5.5"" album pages with 4.5"" x 3.5"" photo openings",,collection of Jeffrey Spencer,Jeffrey SpencerTMI08025,Giant See-Saw,photographs,midway,,"North Midway, North East",,Giant See-Saw and Power House Building.,,,,photograph,"7"" x 5.5"" album pages with 4.5"" x 3.5"" photo openings",,collection of Jeffrey Spencer,Jeffrey SpencerTMI08028,Birdseye View of Grand Court,photographs,grand court,"McKinley Day Wed. Oct. 12, 1898 at Omaha Exposition Birdseye View of Exposition Grounds",Grand Court,,"Aerial view of Grand Court, looking west. Crowd walking around lagoon. ",,1898-10-12,12 October 1898,photograph,"3.5"" x 4.5"" photos pasted on 5.25"" x 6.25"" pages",,collection of Jeffrey Spencer,Jeffrey SpencerTMI08030,"East Midway, Looking North",photographs,midway,East Midway Looking North,"East Midway, South East",,"East Midway, looking north, with view of The Olympia, Moorish Palace and Village, Streets of Cairo, and Power House smokestacks to the northwest, and German Village to the northeast. Crowd walking.",,1898-10-12,12 October 1898,photograph,"3.5"" x 4.5"" photos pasted on 5.25"" x 6.25"" pages",,collection of Jeffrey Spencer,Jeffrey SpencerTMI08032,"North Midway, Looking East",photographs,midway,North Midway Looking East,"North Midway, North West",,"North Midway, with view of Cyclorama, Chinese Village, Haunted Swing, and Remember the Maine. Crowd walking.",,1898-10-12,12 October 1898,photograph,"3.5"" x 4.5"" photos pasted on 5.25"" x 6.25"" pages",,collection of Jeffrey Spencer,Jeffrey SpencerTMI08034,Wild West Show,photographs,midway,Wild West Show N. Midway Shoot the shutes,"North Midway, North",,Close up of Wild West Show participants on horseback. Shooting the Chutes in the background.,,1898-10-12,12 October 1898,photograph,"3.5"" x 4.5"" photos pasted on 5.25"" x 6.25"" pages",,collection of Jeffrey Spencer,Jeffrey SpencerTMI08036,Guards on Grand Plaza,photographs,midway,Guards,"East Midway, South",,"Guards marching on Grand Plaza, in front of Band Stand. A cut out of President William McKinley's profile is mounted to the top of the bandstand.",,1898-10-12,12 October 1898,photograph,"3.5"" x 4.5"" photos pasted on 5.25"" x 6.25"" pages",,collection of Jeffrey Spencer,Jeffrey SpencerTMI08038,North Midway,photographs,midway,West Midway Looking North,"North Midway, South West",,"North Midway, looking northeast toward Schlitz Pavilion and various restaurants. General Offices to the west. Crowd walking.",,1898-10-12,12 October 1898,photograph,"3.5"" x 4.5"" photos pasted on 5.25"" x 6.25"" pages",,collection of Jeffrey Spencer,Jeffrey SpencerTMI08040,Nebraska State Building,photographs,bluff tract,Nebraska Building,"Bluff Tract, East",,Nebraska State Building with light crowd on tree-lined walk.,,1898-10-12,12 October 1898,photograph,"3.5"" x 4.5"" photos pasted on 5.25"" x 6.25"" pages",,collection of Jeffrey Spencer,Jeffrey SpencerTMI08042,U.S. Government Building,photographs,grand court,Govt. Building Showing Dense Crowd,"Grand Court, West",,U.S. Government Building with heavy crowd gathered. U.S. Lifesaving Service boat docked. Swan Boat and Gondolas in water. Fountain of Neptune waters turned on at low height.,,1898-10-12,12 October 1898,photograph,"3.5"" x 4.5"" photos pasted on 5.25"" x 6.25"" pages",,collection of Jeffrey Spencer,Jeffrey SpencerTMI08044,Machinery and Electricity Building and Colonnade,photographs,grand court,Section of Colonnade & West End of Electrical Bldg.,"Grand Court, North East",,Machinery and Electricity Building with Pompeian Colonnade and statues. Light crowd gathered. Flags mounted on roofline. ,,1898-10-12,12 October 1898,photograph,"3.5"" x 4.5"" photos pasted on 5.25"" x 6.25"" pages",,collection of Jeffrey Spencer,Jeffrey SpencerTMI08046,State Buildings on Bluff Tract,photographs,bluff tract,"Bluff Tract - Ill. Bldg, Neb. Bldg, Horticultural Bldg in Distance","Bluff Tract, North West",,"Illinois, Nebraska, Wisconsin, and Iowa State Buildings on Bluff Tract, looking southeast toward Horticultural Building. Montgomery Ward Building in foreground.",,1898-10-12,12 October 1898,photograph,"3.5"" x 4.5"" photos pasted on 5.25"" x 6.25"" pages",,collection of Jeffrey Spencer,Jeffrey SpencerTMI08048,U.S. Government Building with Crowd,photographs,grand court,"Government Building, Front. McKinley rising to go in Bldg. at Column marked x","Grand Court, West",,"Dense Crowd gathered in front of U.S. Government Building for President William McKinley's Visit. Column marked with ""x"" indicates where McKinley stands.",,1898-10-12,12 October 1898,photograph,"3.5"" x 4.5"" photos pasted on 5.25"" x 6.25"" pages",,collection of Jeffrey Spencer,Jeffrey SpencerTMI08050,U.S. Life Saving Service and Crowd,photographs,grand court,Life Boat - Colonnade & Fine Art Bldg.,"Grand Court, South West",,U.S. Life Saving Service in docked life boat. Dense crowd gathered. Fine Arts Building and Southwest Colonnade.,,1898-10-12,12 October 1898,photograph,"3.5"" x 4.5"" photos pasted on 5.25"" x 6.25"" pages",,collection of Jeffrey Spencer,Jeffrey SpencerTMI08052,Agriculture Building,photographs,grand court,Agricultural Building,"Grand Court, North West",,Agriculture Building with Lagoon. Crowd gathered.,,1898-10-12,12 October 1898,photograph,"3.5"" x 4.5"" photos pasted on 5.25"" x 6.25"" pages",,collection of Jeffrey Spencer,Jeffrey SpencerTMI08054,Grand Court Looking North East,photographs,grand court,Looking N.E. From Top of Colonnade,"Grand Court, North West",,"Agriculture Building , Administration Arch, Manufacturers Building, and Machinery and Electricity Building to the northeast, Twin Tower Restaurants to the east, and corner of Fine Arts Building visible in foreground to the south. Dense crowd gathered along lagoon.",,1898-10-12,12 October 1898,photograph,"3.5"" x 4.5"" photos pasted on 5.25"" x 6.25"" pages",,collection of Jeffrey Spencer,Jeffrey SpencerTMI08056,Fine Arts Building and Crowd,photographs,grand court,Fine Arts Building,"Grand Court, South West",,Dense crowd gathered in front of Fine Arts Building.,,1898-10-12,12 October 1898,photograph,"3.5"" x 4.5"" photos pasted on 5.25"" x 6.25"" pages",,collection of Jeffrey Spencer,Jeffrey SpencerTMI08058,Mines and Mining Building,photographs,grand court,Mine & Mining Building,"Grand Court, South East",, View of Mines and Mining Building looking southeast across lagoon. Light crowd walking.,,1898-10-12,12 October 1898,photograph,"3.5"" x 4.5"" photos pasted on 5.25"" x 6.25"" pages",,collection of Jeffrey Spencer,Jeffrey SpencerTMI08060,Administration Arch,photographs,grand court,Administration Arch,"Grand Court, North West",,"View of Administration Arch looking north, across lagoon. Agriculture Building to the west and Manufacturers Building to the east. Balustraded island to the west. Dense crowd gathered.",,1898-10-12,12 October 1898,photograph,"3.5"" x 4.5"" photos pasted on 5.25"" x 6.25"" pages",,collection of Jeffrey Spencer,Jeffrey SpencerTMI08062,Manufacturers Building,photographs,grand court,Manufacturers Building,"Grand Court, North",,Dense crowd gathered in front of Manufacturers Building.,,1898-10-12,12 October 1898,photograph,"3.5"" x 4.5"" photos pasted on 5.25"" x 6.25"" pages",,collection of Jeffrey Spencer,Jeffrey SpencerTMI08064,U.S. Government Building,photographs,grand court,Govt. Building From Bridge,"Grand Court, West",,"View of U.S. Government Building from across lagoon, looking west. Fine Arts Building to the south, and Agriculture Building to the north. Balustraded Island in foreground.",,1898-10-12,12 October 1898,photograph,"3.5"" x 4.5"" photos pasted on 5.25"" x 6.25"" pages",,collection of Jeffrey Spencer,Jeffrey SpencerTMI08066,Liberal Arts Building,photographs,grand court,Liberal Arts Building,"Grand Court, South",,View of Liberal Arts Building looking south east across the lagoon. Balustraded Island in the foreground.,,1898-10-12,12 October 1898,photograph,"3.5"" x 4.5"" photos pasted on 5.25"" x 6.25"" pages",,collection of Jeffrey Spencer,Jeffrey SpencerTMI08068,President William McKinley and Gurdon W. Wattles,photographs,midway,President McKinley Walking without Hat Going to Dinner,"East Midway, South",,President William McKinley and Gurdon W. Wattles walking in front of dense crowd on the Grand Plaza.,,1898-10-12,12 October 1898,photograph,"3.5"" x 4.5"" photos pasted on 5.25"" x 6.25"" pages",,collection of Jeffrey Spencer,Jeffrey SpencerTMI08070,Grand Court,photographs,grand court,Oct 12 - McKinley Day - 1898 view showing Lagoon,"Grand Court, East",,"Grand Court and lagoon, looking west. Mines and Mining, Liberal Arts, and Fine Arts Buildings to the south, U.S. Government Building to the west, and Agriculture Building, Administration Arch, Manufacturers Building, and Machinery and Electricity Building to the North. Light crowd. Swan boat and gondolas in lagoon.",,1898-10-12,12 October 1898,photograph,"3.5"" x 4.5"" photos pasted on 5.25"" x 6.25"" pages",,collection of Jeffrey Spencer,Jeffrey SpencerTMI08072,Notables on President's Day,photographs,midway,Notables following after McKinley,"East Midway, South",,President's Day notables walking in front of crowd gathered in front of Grand Plaza Band Stand. Profile of President William McKinley mounted on Band Stand.,,1898-10-12,12 October 1898,photograph,"3.5"" x 4.5"" photos pasted on 5.25"" x 6.25"" pages",,collection of Jeffrey Spencer,Jeffrey SpencerTMI08074,Grand Colonnade with Garden,photographs,grand court,Section of Colonnade at East End & Flowers,"Grand Court, East",,"Grand Colonnade with Twin Tower Restaurants visible. Gardens at east end of lagoon, with seated fairgoers.",,1898-10-12,12 October 1898,photograph,"3.5"" x 4.5"" photos pasted on 5.25"" x 6.25"" pages",,collection of Jeffrey Spencer,Jeffrey Spencer,TMI08076,Machinery and Electricity Building,photographs,grand court,Electrical Building,"Grand Court, North East",,View of Machinery and Electricity Building with lagoon. Crowd gathered. Swan Boat docked next to east end gardens.,,1898-10-12,12 October 1898,photograph,"3.5"" x 4.5"" photos pasted on 5.25"" x 6.25"" pages",,collection of Jeffrey Spencer,Jeffrey Spencer,TMI08078,Mines and Mining Building Construction,photographs,grand court,Feb 6,"Grand Court, South East",,Construction of the Mines and Mining Building. Close up of entrance.,,1898-02-06,6 February 1898,photograph,"7.5"" x 9""",,collection of Jeffrey Spencer,Jeffrey Spencer,TMI08079,Illinois State Building Construction,photographs,bluff tract,Feb 6,"Bluff Tract, North East",,Construction of Illinois State Building. Framed structure with trees in foreground.,,1898-02-06,6 February 1898,photograph,"7.5"" x 9""",,collection of Jeffrey Spencer,Jeffrey Spencer,TMI08080,Liberal Arts Building Construction,photographs,grand court,,"Grand Court, South",,Construction of the Liberal Arts Building.,,,,photograph,"7.5"" x 9""",,collection of Jeffrey Spencer,Jeffrey Spencer,TMI08081,,photographs,,Feb 6,,,,,1898-02-06,6 February 1898,photograph,"7.5"" x 9""",,collection of Jeffrey Spencer,Jeffrey Spencer,TMI08082,Nebraska State Building Construction,photographs,bluff tract,Feb 6,"Bluff Tract, East",,Construction of the Nebraska State Building.,,1898-02-06,6 February 1898,photograph,"7.5"" x 9""",,collection of Jeffrey Spencer,Jeffrey Spencer,TMI08083,Machinery and Electricity Building Construction,photographs,grand court,No 70 Machinery building from the south Nov. 21 - 1897.,"Grand Court, North East",,Construction of the Machinery and Electricity Building and stairway to lagoon. Water in lagoon.,,1897-11-21,21 November 1897,photograph,"7.5"" x 9""",,collection of Jeffrey Spencer,Jeffrey Spencer,TMI08084,Agriculture Building Construction,photographs,grand court,No 83 Agricultural bldg. view from the southeast Nov. 28 - 1897.,"Grand Court, North West",,Construction of the Agricultural Building.,,1897-11-28,28 November 1897,photograph,"7.5"" x 9""",,collection of Jeffrey Spencer,Jeffrey Spencer,TMI08085,Grand Court Construction,photographs,grand court,No 84 General View. From Manufactures bldg. looking N.W. Nov. 28 - 1897. (mislabeled),"Grand Court, North East",,"Construction of Grand Court. Construction of Agriculture, Administration Arch, and Manufactures Building. Ice skater on lagoon. ",,1897-11-28,28 November 1897,photograph,"7.5"" x 9""",,collection of Jeffrey Spencer,Jeffrey Spencer,TMI08086,Fine Arts Building Construction,photographs,grand court,No 90 Foundation of Fine Arts bldg. view from the East. Dec 5. 1897.,"Grand Court, South West",,Foundation of Fine Arts Building.,,1897-12-05,5 December 1897,photograph,"7.5"" x 9""",,collection of Jeffrey Spencer,Jeffrey Spencer,TMI08087,Mines and Mining Building Construction,photographs,grand court,No 91 Manufactures Bldg. view from the northeast Dec 5 - 1897. (mislabeled),"Grand Court, South East",,Construction of Mines and Mining Building.,,1897-12-05,5 December 1897,photograph,"7.5"" x 9""",,collection of Jeffrey Spencer,Jeffrey Spencer,TMI08088,Manufactures Building Construction,photographs,grand court,No 93 Mines Building interior view from the west. Dec. 5th - 1897. (mislabeled),"Grand Court, North",,Construction of Manufactures Building. Interior view. Worker stands near ladder.,,1897-12-05,5 December 1897,photograph,"7.5"" x 9""",,collection of Jeffrey Spencer,Jeffrey Spencer,TMI08089,Mines and Mining Building Construction,photographs,grand court,No 71 Manufactures bldg. interior view from the west Nov. 21 - 1897. (mislabeled),"Grand Court, South East",,Construction of Mines and Mining Building. Interior view.,,1897-11-21,21 November 1897,photograph,"7.5"" x 9""",,collection of Jeffrey Spencer,Jeffrey Spencer,TMI08090,Machinery and Electricity Building Construction,photographs,grand court,No 73 Machinery building from the southwest. Nov. 21 - 1897,"Grand Court, North",,Construction of the Machinery and Electricity Building.,,1897-11-21,21 November 1897,photograph,"7.5"" x 9""",,collection of Jeffrey Spencer,Jeffrey Spencer,TMI08091,Mines and Mining Building Construction,photographs,grand court,No 85 Manufactures Bldg. interior view from the west. Nov. 28 - 1897 (mislabeled),"Grand Court, South East",,Construction of the Mines and Mining Building. Interior View.,,1897-11-28,28 November 1897,photograph,"7.5"" x 9""",,collection of Jeffrey Spencer,Jeffrey Spencer,TMI08092,Mines and Mining Building Construction,photographs,grand court,No 72 Manufactures bldg. from the north-west Nov. 21 - 1897 (mislabeled),"Grand Court, South East",,Construction of Mines and Mining Building.,,1897-11-21,21 November 1897,photograph,"7.5"" x 9""",,collection of Jeffrey Spencer,Jeffrey Spencer,TMI08093,Manufactures Building Construction,photographs,grand court,No 74 Mines building interior view form the east. Nov. 21 - 1897 (mislabeled),"Grand Court, North",,Construction of Manufactures Building. Interior.,,1897-11-21,21 November 1897,photograph,"7.5"" x 9""",,collection of Jeffrey Spencer,Jeffrey Spencer,TMI08094,Mines and Mining Building Construction,photographs,grand court,No 76 Manufactures Bldg. view from the Northwest. Nov 28 - 1897. (mislabeled),"Grand Court, South East",,Construction of Mines and Mining Building.,,1897-11-28,28 November 1897,photograph,"7.5"" x 9""",,collection of Jeffrey Spencer,Jeffrey Spencer,TMI08095,Liberal Arts Building Construction,photographs,grand court,No 38 Liberal Arts Bldg. View from the northwest. Nov. 6 1897.,"Grand Court, South",,Construction of Liberal Arts Building.,,1897-11-06,6 November 1897,photograph,"7.5"" x 9""",,collection of Jeffrey Spencer,Jeffrey Spencer,TMI08096,Manufactures Building Construction,photographs,grand court,No 64 View from Administration bldg. looking east on Mines Nov. 14 - 1897. (mislabeled),"Grand Court, North",,Construction of Manufactures Building. Man stands atop framework.,,1897-11-14,14 November 1897,photograph,"7.5"" x 9""",,collection of Jeffrey Spencer,Jeffrey Spencer,TMI08097,Manufactures Building Construction,photographs,grand court,No 78 Mines Building interior view from the east. Nov. 28 - 1897. (mislabeled),"Grand Court, North",,Construction of Manufactures Building. Interior view.,,1897-11-28,28 November 1897,photograph,"7.5"" x 9""",,collection of Jeffrey Spencer,Jeffrey Spencer,TMI08098,Mines and Mining Building Construction,photographs,grand court,No 69 Manufactures bldg. from the northeast Nov. 21 - 1897. (mislabeled),"Grand Court, South East",,Construction of Mines and Mining Building.,,1897-11-21,21 November 1897,photograph,"7.5"" x 9""",,collection of Jeffrey Spencer,Jeffrey Spencer,TMI08099,Mines and Mining Building Construction,photographs,grand court,No 63 Manufactures Bldg. view from the northwest Nov. 14 - 1897 (mislabeled),"Grand Court, South East",,Construction of Mines and Mining Building.,,1897-11-14,14 November 1897,photograph,"7.5"" x 9""",,collection of Jeffrey Spencer,Jeffrey Spencer,TMI08100,Mines and Mining Building Construction,photographs,grand court,No 88 Manufactures Bldg. interior view from the west Dec 5. - 1897. (mislabeled),"Grand Court, South East",,Construction of Manufactures Building. Interior view.,,1897-12-05,5 December 1897,photograph,"7.5"" x 9""",,collection of Jeffrey Spencer,Jeffrey Spencer,TMI08101,Manufactures Building Construction,photographs,grand court,No 56 Mines Building Interior view from the east. Nov. 14 - 1897. (mislabeled),"Grand Court, North",,"Construction of Manufactures Building. Interior, with view to Administration Arch. One worker poses.",,1897-11-14,14 November 1897,photograph,"7.5"" x 9""",,collection of Jeffrey Spencer,Jeffrey Spencer,