id,title,category,sub_category,caption,location,pages,description,keywords,dateNormalized,date,medium,size,creator,collection,provenanceTMI08245,Midway - U.S. vs. Spain,photographs,midway,,"North Midway, West",,"Remember the Maine. Signage reads: ""U.S. Versus Spain. Havana and the Maine. A Realistic Production on Real Water. Admission 10 Cents."" A few spectators walk by. Haunted Swing to the east.",,,,35mm slides,"2"" x 2"" slide casing with 1.5"" x 1"" opening",,collection of Jeffrey Spencer,Jeffrey SpencerTMI08246,Nebraska State Building,photographs,bluff tract,,"Bluff Tract, North West",,"Nebraska State Building. Trees, concession stand, and light crowd in front.",,,,35mm slides,"2"" x 2"" slide casing with 1.5"" x 1"" opening",,collection of Jeffrey Spencer,Jeffrey SpencerTMI08247,Pottawattamie County Wigwam,photographs,bluff tract,,"Bluff Tract, West",,Pottawattamie County Wigwam. A pair of men walking in foreground. Star Tobacco Building and light crowd to the north. ,,,,35mm slides,"2"" x 2"" slide casing with 1.5"" x 1"" opening",,collection of Jeffrey Spencer,Jeffrey SpencerTMI08248,Giant See-Saw,photographs,midway,,"North Midway, North East",,Giant See-Saw and Power House Building.,,,,35mm slides,"2"" x 2"" slide casing with 1.5"" x 1"" opening",,collection of Jeffrey Spencer,Jeffrey SpencerTMI08249,Construction Steam Pile Driver Spring of 1897,photographs,grand court,,"Grand Court, South",,Crowd gathered around pile driver. Laying Cornerstone of Arch of States.,,1897,Spring 1897,35mm slides,"2"" x 2"" slide casing with 1.5"" x 1"" opening",,collection of Jeffrey Spencer,Jeffrey SpencerTMI08250,Construction of Horticultural Building,photographs,bluff tract,,"Bluff Tract, South",,Construction of the Horticultural Building.,,,,35mm slides,"2"" x 2"" slide casing with 1.5"" x 1"" opening",,collection of Jeffrey Spencer,Jeffrey SpencerTMI08251,Construction of Manufactures Building,photographs,grand court,,"Grand Court, North",,Construction of the Manufactures Building. Man standing and horse drawn carriages in foreground.,,,,35mm slides,"2"" x 2"" slide casing with 1.5"" x 1"" opening",,collection of Jeffrey Spencer,Jeffrey SpencerTMI08252,Construction of the Moorish Palace,photographs,midway,,"East Midway, South West",,"Construction of the Moorish Palace, with snow.",,,,35mm slides,"2"" x 2"" slide casing with 1.5"" x 1"" opening",,collection of Jeffrey Spencer,Jeffrey SpencerTMI08253,Construction of the Auditorium,photographs,grand court,Auditorium Bldg. Rinehart Photo.,"Grand Court, South East",,Construction of the Auditorium.,,,,35mm slides,"2"" x 2"" slide casing with 1.5"" x 1"" opening",,collection of Jeffrey Spencer,Jeffrey SpencerTMI08254,Construction of Steam Pile driver,photographs,,,,,Construction of Steam Pile Driver. Light crowd. Pair of horses in foreground. Train cars in background.,,,,35mm slides,"2"" x 2"" slide casing with 1.5"" x 1"" opening",,collection of Jeffrey Spencer,Jeffrey SpencerTMI08255,Construction of Illinois Building,photographs,bluff tract,,"Bluff Tract, North East",,Construction of Illinois Building.,,,,35mm slides,"2"" x 2"" slide casing with 1.5"" x 1"" opening",,collection of Jeffrey Spencer,Jeffrey SpencerTMI08256,Construction of Nebraska Building,photographs,bluff tract,,"Bluff Tract, East",,Construction of Nebraska Building. Four men pose in front of building.,,,,35mm slides,"2"" x 2"" slide casing with 1.5"" x 1"" opening",,collection of Jeffrey Spencer,Jeffrey SpencerTMI08257,Construction of Mines and Mining Building,photographs,grand court,,"Grand Court, South East",,Construction of the Mines and Mining Building with workers next to lagoon.,,,,35mm slides,"2"" x 2"" slide casing with 1.5"" x 1"" opening",,collection of Jeffrey Spencer,Jeffrey SpencerTMI08258,Construction of Grand Court,photographs,grand court,,"Grand Court, South East",,"Construction of Mines and Mining Building and Administration Arch, looking southeast, across lagoon.",,,,35mm slides,"2"" x 2"" slide casing with 1.5"" x 1"" opening",,collection of Jeffrey Spencer,Jeffrey SpencerTMI08259,Construction of Horticultural Building,photographs,bluff tract,,"Bluff Tract, South",,Construction of Horticulture Building.,,,,35mm slides,"2"" x 2"" slide casing with 1.5"" x 1"" opening",,collection of Jeffrey Spencer,Jeffrey SpencerTMI08260,Construction of Grand Court,photographs,grand court,,"Grand Court, East",,Construction of Grand Court. Administration Arch and Mines and Mining Building visible with empty lagoon.,,,,35mm slides,"2"" x 2"" slide casing with 1.5"" x 1"" opening",,collection of Jeffrey Spencer,Jeffrey SpencerTMI08261,Construction of Illinois Building,photographs,bluff tract,,"Bluff Tract, North East",,Construction of Illinois Building.,,,,35mm slides,"2"" x 2"" slide casing with 1.5"" x 1"" opening",,collection of Jeffrey Spencer,Jeffrey SpencerTMI08262,Construction of North Midway,photographs,midway,Section Midway. Rinehart Photo.,"North Midway, North",,"Construction of North Midway. Schlitz Pavilion, Streets of All Nations, Cyclorama, and Chinese Village construction visible.",,,,35mm slides,"2"" x 2"" slide casing with 1.5"" x 1"" opening",,collection of Jeffrey Spencer,Jeffrey SpencerTMI08263,Construction of Shooting the Chutes,photographs,midway,North Section of Midway,"North Midway, East",,"North Midway. Shooting the Chutes, Pabst Building, and Scenic Railway visible.",,,,35mm slides,"2"" x 2"" slide casing with 1.5"" x 1"" opening",,collection of Jeffrey Spencer,Jeffrey SpencerTMI08264,Construction of Illinois Building,photographs,bluff tract,,"Bluff Tract, North East",,"Construction of Illinois Building, with snow.",,,,35mm slides,"2"" x 2"" slide casing with 1.5"" x 1"" opening",,collection of Jeffrey Spencer,Jeffrey SpencerTMI08265,Construction of Mines and Mining Building,photographs,grand court,,"Grand Court, South East",,Construction of Mines and Mining Building. Light crowd and horse drawn carriages line lagoon edge.,,,,35mm slides,"2"" x 2"" slide casing with 1.5"" x 1"" opening",,collection of Jeffrey Spencer,Jeffrey SpencerTMI08266,Construction of Mines and Mining Building,photographs,grand court,,"Grand Court, South East",,Construction of the Mines and Mining Building.,,,,35mm slides,"2"" x 2"" slide casing with 1.5"" x 1"" opening",,collection of Jeffrey Spencer,Jeffrey SpencerTMI08267,Construction of U.S. Government Building,photographs,grand court,,"Grand Court, West",,"U.S. Government Building.  Swan Boat and Gondola in lagoon. A few people stand in foreground, overlooking lagoon.",,,,35mm slides,"2"" x 2"" slide casing with 1.5"" x 1"" opening",,collection of Jeffrey Spencer,Jeffrey SpencerTMI08268,Construction of Moorish Palace ,photographs,midway,,"East Midway, South West",,"Construction of the Moorish Palace, with snow.",,,,35mm slides,"2"" x 2"" slide casing with 1.5"" x 1"" opening",,collection of Jeffrey Spencer,Jeffrey SpencerTMI08269,Construction of Nebraska Building,photographs,bluff tract,,"Bluff Tract, East",,Construction of Nebraska Building. Four men pose in front of building.,,,,35mm slides,"2"" x 2"" slide casing with 1.5"" x 1"" opening",,collection of Jeffrey Spencer,Jeffrey SpencerTMI08270,Construction of Nebraska Building,photographs,bluff tract,,"Bluff Tract, East",,Construction of Nebraska Building.,,,,35mm slides,"2"" x 2"" slide casing with 1.5"" x 1"" opening",,collection of Jeffrey Spencer,Jeffrey SpencerTMI08271,Construction of Transportation and Agricultural Implements Building,photographs,transportation,Agricultural and Impliments [sic.].,"Transportation, Center",,Construction of Transportation and Agricultural Implements Building. Two logs in foreground.,,,,35mm slides,"2"" x 2"" slide casing with 1.5"" x 1"" opening",,collection of Jeffrey Spencer,Jeffrey SpencerTMI08272,Construction of Shooting the Chutes,photographs,midway,,"North Midway, South East",,"Construction of North Midway. Shooting the Chutes, with Chinese Village and Animal Show buildings in background.",,,,35mm slides,"2"" x 2"" slide casing with 1.5"" x 1"" opening",,collection of Jeffrey Spencer,Jeffrey SpencerTMI08273,Construction of Scenic Railway,photographs,midway,,"North Midway, North East",,"Construction of North Midway, with Pabst Building and Scenic Railway.",,,,35mm slides,"2"" x 2"" slide casing with 1.5"" x 1"" opening",,collection of Jeffrey Spencer,Jeffrey SpencerTMI08282,Grand Court Colonnade Construction,photographs,grand court,,"Grand Court, East",,Construction of Grand Court. Twin Tower Restaurants and Grand Colonnade to the east. Auditorium to the southeast. Stairway to lagoon in foreground.,,,,35mm slides,"2"" x 2"" slide casing with 1.5"" x 1"" opening",,collection of Jeffrey Spencer,Jeffrey SpencerTMI08283,Grand Court Construction,photographs,grand court,,"Grand Court, West",,"Construction of Grand Court. Administration Arch to the northeast, and Mines and Mining Building to the southeast. Retaining walls for lagoon in place.",,,,35mm slides,"2"" x 2"" slide casing with 1.5"" x 1"" opening",,collection of Jeffrey Spencer,Jeffrey SpencerTMI08284,Grand Court Construction,photographs,grand court,,"Grand Court, South East",,"Construction of Grand Court. Administration Arch to the northwest, and Mines and Mining Building in left foreground. Retaining walls for lagoon in place. A few people walk construction grounds.",,,,35mm slides,"2"" x 2"" slide casing with 1.5"" x 1"" opening",,collection of Jeffrey Spencer,Jeffrey SpencerTMI08285,Arch of States Construction (?),photographs,grand court,,"Grand Court, South West",,"Construction of Arch of States (?). Pile driver, vertical logs, and light crowd gathered. Two horses in foreground. Train and row of houses in background.",,,,35mm slides,"2"" x 2"" slide casing with 1.5"" x 1"" opening",,collection of Jeffrey Spencer,Jeffrey SpencerTMI08286,Auditorium Construction,photographs,grand court,,"Grand Court, South East",,Construction of Auditorium. A man walks near entrance. Made from a Rinehart photograph.,,,,35mm slides,"2"" x 2"" slide casing with 1.5"" x 1"" opening",,collection of Jeffrey Spencer,Jeffrey SpencerTMI08287,Mines and Mining Building Construction,photographs,grand court,,"Grand Court, South East",,Construction of Mines and Mining Building. Water in lagoon. People stand along top of lagoon retaining wall.,,,,35mm slides,"2"" x 2"" slide casing with 1.5"" x 1"" opening",,collection of Jeffrey Spencer,Jeffrey SpencerTMI08288,East Midway,photographs,midway,,"East Midway, South West",,"Construction of East Midway. View of Twin Tower Restaurants and Moorish village, looking north.. Made From a Rinehart photograph. Lamp post in right foreground.",,,,35mm slides,"2"" x 2"" slide casing with 1.5"" x 1"" opening",,collection of Jeffrey Spencer,Jeffrey SpencerTMI08289,North Midway,photographs,midway,,"North Midway, North East",,"North Midway construction. Pabst Building, Scenic Railway, and small, one-story rectangular building. A few people stand along walkway and lean against lamp posts.",,,,35mm slides,"2"" x 2"" slide casing with 1.5"" x 1"" opening",,collection of Jeffrey Spencer,Jeffrey SpencerTMI08290,Filling the Lagoon,photographs,grand court,,"Grand Court, East",,"Filling of the lagoon.  East End of lagoon, with stairways. Grand Colonnade,  Moorish Village, and Twin Tower Restaurant in background. Made from a Rinehart photograph.",,,,35mm slides,"2"" x 2"" slide casing with 1.5"" x 1"" opening",,collection of Jeffrey Spencer,Jeffrey SpencerTMI08291,Shooting the Chutes Construction,photographs,midway,,"North Midway, South East",,Construction of Shooing the Chutes.,,,,35mm slides,"2"" x 2"" slide casing with 1.5"" x 1"" opening",,collection of Jeffrey Spencer,Jeffrey SpencerTMI08292,Transportation and Agricultural Implements Building Construction,photographs,transportation,,"Transportation, Center",,Construction of the Transportation and Agricultural Implements Building. Two men and two horse drawn carriages stand near the building. Two logs in the foreground. Made from a Rinehart photograph.,,,,35mm slides,"2"" x 2"" slide casing with 1.5"" x 1"" opening",,collection of Jeffrey Spencer,Jeffrey SpencerTMI08293,Streets of Cairo Construction,photographs,midway,,"East Midway, North West",,Construction of Streets of Cairo. Made from a Rinehart Photograph.,,,,35mm slides,"2"" x 2"" slide casing with 1.5"" x 1"" opening",,collection of Jeffrey Spencer,Jeffrey SpencerTMI08294,U.S. Government Building Construction,photographs,grand court,,"Grand Court, West",,Construction of U.S. Government Building. Horse drawn carriage in front of structure. Retaining wall of lagoon visible.,,,,35mm slides,"2"" x 2"" slide casing with 1.5"" x 1"" opening",,collection of Jeffrey Spencer,Jeffrey SpencerTMI08295,Filling the Lagoon,photographs,grand court,,"Grand Court, East",,"Filling of the lagoon.  East End of lagoon, with stairways. Grand Colonnade,  Moorish Village, and Twin Tower Restaurant in background. Made from a Rinehart photograph.",,,,35mm slides,"2"" x 2"" slide casing with 1.5"" x 1"" opening",,collection of Jeffrey Spencer,Jeffrey SpencerTMI08296,Skating on the Lagoon,photographs,grand court,,"Grand Court, North West",,Ice skaters on lagoon. Agriculture Building and Administration Arch in background.,,,Winter 1897-1898,35mm slides,"2"" x 2"" slide casing with 1.5"" x 1"" opening",,collection of Jeffrey Spencer,Jeffrey SpencerTMI08297,Grand Colonnade Construction,photographs,grand court,,"Grand Court, South East",,Construction of Grand Court. Twin Tower Restaurants and Grand Colonnade to the east. Auditorium to the southeast. Stairway to lagoon in foreground.,,,,35mm slides,"2"" x 2"" slide casing with 1.5"" x 1"" opening",,collection of Jeffrey Spencer,Jeffrey SpencerTMI08298,Agriculture Building Demolition,photographs,grand court,,"Grand Court, West",,"Demolition of Agriculture Building. Man standing on rubble, facing camera. Administration Arch to the east. Twin Tower Restaurant to the east. Liberal Arts Building to the south.",,,,35mm slides,"2"" x 2"" slide casing with 1.5"" x 1"" opening",,collection of Jeffrey Spencer,Jeffrey SpencerTMI08299,Grand Court Demolition,photographs,grand court,,"Grand Court, South East",,"Demolition of Grand Court. Grand Colonnade, Northwest Twin Tower Restaurant, Band Stand, and Auditorium still stand to the east. Wreckage of Mines and Mining and Liberal Arts Buildings to the south of colonnade that formally connected the two structures.",,,,35mm slides,"2"" x 2"" slide casing with 1.5"" x 1"" opening",,collection of Jeffrey Spencer,Jeffrey SpencerTMI08300,German and Hawaiian Villages,photographs,midway,,"East Midway, East",,Demolition of East Midway. German Village and Hawaiian Village.,,,,35mm slides,"2"" x 2"" slide casing with 1.5"" x 1"" opening",,collection of Jeffrey Spencer,Jeffrey SpencerTMI08301,Arch of States Construction,photographs,grand court,,"Grand Court, South",,Construction of Arch of States. Crowd gathered around pile driver. Some hold umbrellas.  Row of houses in background.,,,,35mm slides,"2"" x 2"" slide casing with 1.5"" x 1"" opening",,collection of Jeffrey Spencer,Jeffrey SpencerTMI08302,Administration Arch Construction,photographs,grand court,,"Grand Court, North",,Construction of Administration Arch.,,,,35mm slides,"2"" x 2"" slide casing with 1.5"" x 1"" opening",,collection of Jeffrey Spencer,Jeffrey SpencerTMI08303,Streets of Cairo Construction,photographs,midway,,"East Midway, North West",,Construction of Streets of Cairo. Made from a Rinehart Photograph.,,,,35mm slides,"2"" x 2"" slide casing with 1.5"" x 1"" opening",,collection of Jeffrey Spencer,Jeffrey SpencerTMI08304,Arch of States Construction,photographs,grand court,,"Grand Court, South",,Construction of Arch of States. Crowd gathered around pile driver. Some hold umbrellas.  Row of houses in background.,,1897,Spring 1897,35mm slides,"2"" x 2"" slide casing with 1.5"" x 1"" opening",,collection of Jeffrey Spencer,Jeffrey SpencerTMI08305,Machinery and Electricity Building Construction,photographs,grand court,,"Grand Court, North East",,"Construction of Machinery and Electricity Building. Man and woman walk in empty lagoon, near retaining wall.",,,,35mm slides,"2"" x 2"" slide casing with 1.5"" x 1"" opening",,collection of Jeffrey Spencer,Jeffrey SpencerTMI08306,Water Pump,photographs,grand court,,"Grand Court, North East",,Two workers pose next to water pump. Two young girls play nearby.,,,,35mm slides,"2"" x 2"" slide casing with 1.5"" x 1"" opening",,collection of Jeffrey Spencer,Jeffrey SpencerTMI08307,Streets of All Nations Demolition,photographs,midway,,"North Midway, North West",,Demolition of Streets of All Nations. Portion of the Theater and Old Plantation cabins still standing.,,,,35mm slides,"2"" x 2"" slide casing with 1.5"" x 1"" opening",,collection of Jeffrey Spencer,Jeffrey SpencerTMI08308,Machinery and Electricity Building Demolition,photographs,grand court,,"Grand Court, North East",,Demolition of Machinery and Electricity Building. Image appears to have been reproduced from a printed text.,,,,35mm slides,"2"" x 2"" slide casing with 1.5"" x 1"" opening",,collection of Jeffrey Spencer,Jeffrey SpencerTMI08309,Skating on the Lagoon,photographs,grand court,,"Grand Court, North West",,Ice skaters on lagoon. Agriculture Building and Administration Arch in background.,,,Winter 1897-1898,35mm slides,"2"" x 2"" slide casing with 1.5"" x 1"" opening",,collection of Jeffrey Spencer,Jeffrey SpencerTMI08310,Mines and Mining Building Construction,photographs,grand court,,"Grand Court, South East",,Construction of Mines and Mining Building. ,,,,35mm slides,"2"" x 2"" slide casing with 1.5"" x 1"" opening",,collection of Jeffrey Spencer,Jeffrey Spencer,TMI08311,Administration Arch Construction,photographs,grand court,,"Grand Court, North",,Construction of Administration Arch.,,,,35mm slides,"2"" x 2"" slide casing with 1.5"" x 1"" opening",,collection of Jeffrey Spencer,Jeffrey Spencer,TMI08312,Mines and Mining Building Construction,photographs,grand court,,"Grand Court, South East",,"Construction of Mines and Mining Building. Crowd, bicyclists, and horse drawn carriages on both sides of empty lagoon.",,,,35mm slides,"2"" x 2"" slide casing with 1.5"" x 1"" opening",,collection of Jeffrey Spencer,Jeffrey Spencer,TMI08313,Mines and Mining Building Construction,photographs,grand court,,"Grand Court, South East",," Construction of Mines and Mining Building and Liberal Arts Building, looking southeast. Crowd walks along top of retaining wall lining lagoon.",,,,35mm slides,"2"" x 2"" slide casing with 1.5"" x 1"" opening",,collection of Jeffrey Spencer,Jeffrey Spencer,TMI08314,U.S. Government Building Construction,photographs,grand court,,"Grand Court, West",,Construction of U.S. Government Building. People stand along railing of lagoon. Swan boat and gondolas in water.,,,,35mm slides,"2"" x 2"" slide casing with 1.5"" x 1"" opening",,collection of Jeffrey Spencer,Jeffrey Spencer,TMI08315,Machinery and Electricity Building,photographs,grand court,,"Grand Court, North East",,"View of Machinery and Electricity Building, looking northeast across lagoon.",,1898-10-30,30 October 1898,photograph,"4.25"" x 5.5""",Private Secretary of Henry R. Plimpton II,collection of Jeffrey Spencer,Jeffrey Spencer,TMI08317,"Grand Court and Lagoon, Looking East",photographs,grand court,,"Grand Court, West",,"Grand Court and lagoon, looking east. Agriculture Building, Administration Arch, Manufactures and Machinery and Electricity Buildings to the northeast, Twin Tower Restaurants, Grand Colonnade,  Balustraded Island, and Fountain of Neptune to the east, and Mines and Mining and Liberal Arts Building, Arch of States, and Fines Arts Building to the southeast. Man walking in lower right corner of frame.",,1898-10-30,30 October 1898,photograph,"4.25"" x 5.5""",Private Secretary of Henry R. Plimpton II,collection of Jeffrey Spencer,Jeffrey Spencer,TMI08319,Agriculture Building,photographs,grand court,,"Grand Court, North West",,View of Agriculture Building and colonnade looking northwest across lagoon. Roofline of Administration Arch visible in background.,,1898-10-30,30 October 1898,photograph,"4.25"" x 5.5""",Private Secretary of Henry R. Plimpton II,collection of Jeffrey Spencer,Jeffrey Spencer,TMI08321,Miniature Railroad,photographs,transportation,,"Transportation, North West",,Crowd gathered at Miniature Railroad station. Train with passengers on tracks.,,1898-10-30,30 October 1898,photograph,"4.25"" x 5.5""",Private Secretary of Henry R. Plimpton II,collection of Jeffrey Spencer,Jeffrey Spencer,TMI08323,North Midway,photographs,midway,,"North Midway, North",,Crowd walking in front of Cyclorama on north midway. Pabst Building and Giant See-Saw visible in background.,,1898-10-30,30 October 1898,photograph,"4.25"" x 5.5""",Private Secretary of Henry R. Plimpton II,collection of Jeffrey Spencer,Jeffrey Spencer,TMI08325,Manufactures Building,photographs,grand court,,"Grand Court, North",,View of Manufacturers Building looking northwest across lagoon. Agriculture Building and Administration Arch visible.,,1898-10-30,30 October 1898,photograph,"4.25"" x 5.5""",Private Secretary of Henry R. Plimpton II,collection of Jeffrey Spencer,Jeffrey Spencer,TMI08327,Agriculture Building,photographs,grand court,,"Grand Court, North West",,"Corner of the Agriculture Building, with light crowd gathered outside.",,1898-10-30,30 October 1898,photograph,"4.25"" x 5.5""",Private Secretary of Henry R. Plimpton II,collection of Jeffrey Spencer,Jeffrey Spencer,TMI08329,Liberal Arts Building,photographs,grand court,,"Grand Court, South",,Liberal Arts Building with colonnade and statuary.,,1898-10-30,30 October 1898,photograph,"4.25"" x 5.5""",Private Secretary of Henry R. Plimpton II,collection of Jeffrey Spencer,Jeffrey Spencer,TMI08331,"Grand Court and Lagoon, Looking East",photographs,grand court,,"Grand Court, West",,"West end of lagoon, with Statue of Nautilus. Crowd gathered near benches in foreground. Fountains turned off. Administration Arch, Manufactures Building, Machinery and Electricity Building to the northeast, Twin Tower Restaurants to the east, Mines and Mining Building, Liberal Arts Building, and Fine Arts Building to the southeast.",,1898-10-30,30 October 1898,photograph,"4.25"" x 5.5""",Private Secretary of Henry R. Plimpton II,collection of Jeffrey Spencer,Jeffrey Spencer,TMI08333,Agriculture Building,photographs,grand court,,"Grand Court, North West",,"View of Agriculture Building looking northeast across lagoon. Woman stands in foreground, leaning against lagoon railing, facing lagoon. Administration Arch  and Manufacturers Building to the northeast.",,1898-10-30,30 October 1898,photograph,"4.25"" x 5.5""",Private Secretary of Henry R. Plimpton II,collection of Jeffrey Spencer,Jeffrey Spencer,TMI08335,Mines and Mining Building,photographs,grand court,,"Grand Court, South East",,Mines and Mining Building with Colonnade and statuary.,,1898-10-30,30 October 1898,photograph,"4.25"" x 5.5""",Private Secretary of Henry R. Plimpton II,collection of Jeffrey Spencer,Jeffrey Spencer,TMI08337,Moorish Village,photographs,midway,,"East Midway, South West",,"Palace of Mysteries, with attached Moorish Restaurant and Moorish Palace. Corner of Twin Tower Restaurant to the southwest.",,1898-10-30,30 October 1898,photograph,"4.25"" x 5.5""",Private Secretary of Henry R. Plimpton II,collection of Jeffrey Spencer,Jeffrey Spencer,TMI08339,Machinery and Electricity Building,photographs,grand court,,"Grand Court, North East",,Corner of Machinery and Electricity Building and Statuary. Light crowd walking. Twin Tower Restaurant and Grand Colonnade visible in background.,,1898-10-30,30 October 1898,photograph,"4.25"" x 5.5""",Private Secretary of Henry R. Plimpton II,collection of Jeffrey Spencer,Jeffrey Spencer,TMI08341,Agriculture Building,photographs,grand court,,"Grand Court, North West",,Crowd of women gathered around lagoon railing in foreground. Man with hands in pockets faces camera. Agriculture Building and electric lamp post in background.,,1898-10-30,30 October 1898,photograph,"4.25"" x 5.5""",Private Secretary of Henry R. Plimpton II,collection of Jeffrey Spencer,Jeffrey Spencer,TMI08343,North Midway,photographs,midway,,"North Midway, North East",,"Light crowd walking north midway. Pabst Building, Scenic Railway, and Idols of Arts  visible.",,1898-10-30,30 October 1898,photograph,"4.25"" x 5.5""",Private Secretary of Henry R. Plimpton II,collection of Jeffrey Spencer,Jeffrey Spencer,TMI08345,North Midway,photographs,grand court,,"North Midway, South West",,"Entrance through Administration Arch into North Midway. Crowd in foreground. Hospital, General Offices, Press Building, and Camera Obscura in background.",,1898-10-30,30 October 1898,photograph,"4.25"" x 5.5""",Private Secretary of Henry R. Plimpton II,collection of Jeffrey Spencer,Jeffrey Spencer,TMI08347,Fine Arts Building,photographs,grand court,,"Grand Court, South West",,"Corner of Fine Arts Building, looking southeast. Light crowd walks along building. Twin Tower Restaurant, Grand Colonnade, Mines and Mining Building to the southeast, and Liberal Arts Building visible through trees lining walkway.",,1898-10-30,30 October 1898,photograph,"4.25"" x 5.5""",Private Secretary of Henry R. Plimpton II,collection of Jeffrey Spencer,Jeffrey Spencer,TMI08349,U.S. Government Building,photographs,grand court,,"Grand Court, West",,U.S. Government Building and sections of colonnades with lagoon and Fountain of Nautilus. Light crowd gathered on steps. Boat docked.,,1898-10-30,30 October 1898,photograph,"4.25"" x 5.5""",Private Secretary of Henry R. Plimpton II,collection of Jeffrey Spencer,Jeffrey Spencer,